fecha;hora;numero incidencia;localizacion;ubicacion;carretera;eje;tipo via;tipo accidente;tipo colision;vehiculos implicados;motocicletas implicadas;pesados implicados;estado del firme;circulacion;heridos leves;heridos graves;victimas mortales;descripcion
13/04/2021 0:00;14:44:00;20210413-0021;01XC90;SUPERFICIE;M30;XC;TRONCO;Colision entre vehiculos;COLISIÓN LATERAL;4;0;0;Mojado;CONGESTIONADA;0;0;0;ACCIDENTE ENTRE VEHÍCULOS (SIN HERIDOS ) A LA LLEGADA DE POLICIA LOS VEHICULOS SON RETIRADOS AL PK 01XC00 AL ARCEN DERECHO TODOS LOS VEHICULOS SE RETIRAN POR SUS MEDIOS
13/04/2021 0:00;16:16:18;20210413-0026;32RA50;SUPERFICIE;M30;32RA;RAMAL;Salida de via;COLISIÓN LATERAL;1;0;0;Mojado;FLUIDA;0;0;0;Accidente sin heridos en carril derecho. Vehículo colisiona contra el muro de hormigón del margen izquierdo y termina colisionando contra la barrera del margen derecho. Vehículo retirado por su grúa. Se avisa a personal de conservación para señalizar los daños con New Jerseys y retirar CPN .
14/04/2021 0:00;9:01:36;20210414-0010;10NL70;SUPERFICIE;M30;NL;VIA DE SERVICIO;Colision entre vehiculos;COLISIÓN POR ALCANCE;2;0;0;Seco y limpio;CONGESTIONADA;0;0;0;señalizar accidente por alcance en carril derecho, vehículo número 1 se retira por sus propios medios vehículo número 2 se retira en grúa López Ollero a la espera de su grúa, sin daños ni heridos
14/04/2021 0:00;9:13:28;20210414-0011;11XL50;SUPERFICIE;M30;XL;VIA DE SERVICIO;Colision entre vehiculos;COLISIÓN POR ALCANCE;2;0;0;Seco y limpio;DENSA;1;0;0;señalizar accidente entre dos vehículos en carril izquierdo samur interviene en el punto atendiendo a dos usuarios de vehículo uno y siendo dados de alta en el punto vehículo uno y vehículo dos son retirados por las grúas de los usuarios vehículo 1 produce daños en new Yersey y no se le toman datos del seguro porque policía informa que no tiene seguro
14/04/2021 0:00;12:41:23;20210414-0018;09XL90;SUPERFICIE;M30;XL;VIA DE SERVICIO;Colision entre vehiculos;COLISIÓN POR ALCANCE;4;0;0;Seco y limpio;DENSA;1;0;0;Señalizar accidente entre 4 vehículos en carril derechoSamur interviene en el punto atendiendo a usuarias de vehículo dos y dándolas de alta en el puntoVehículo uno y vehículo dos salen por sus medios vehículo tres y vehículo cuatro son retirados por sus grúas del seguro
14/04/2021 0:00;13:31:59;20210414-0019;09NL90;SUPERFICIE;M30;NL;VIA DE SERVICIO;Colision entre vehiculos;COLISIÓN POR ALCANCE;2;0;0;Seco y limpio;CONGESTIONADA;0;0;0;señalizar un alcance entre dos vehículos uno se lo lleva la grúa de Ollero y la otra se va por sus propios medios
14/04/2021 0:00;15:20:21;20210414-0025;08VA22;SUPERFICIE;A3;08VA;RAMAL;Colision entre vehiculos;COLISIÓN POR ALCANCE;2;0;0;Seco y limpio;CONGESTIONADA;0;0;0;AVISO DE CENTRO DE CONTROL PARA SEÑALIZAR VEHICULO PARADO. A LA LLEGADA SE TRATA DE UN ACCIDENTE POR ALCANCE ENTRE DOS TURISMOS SIN HERIDOS Y CON DAÑOS A PATRIMONIO. LOS DOS VEHICULOS IMPLICADOS SON RETIRADOS POR SUS RESPECTIVAS GRUAS DE USUARIO.
14/04/2021 0:00;17:53:29;20210414-0031;09NL40;SUPERFICIE;M30;NL;VIA DE SERVICIO;Colision entre vehiculos;COLISIÓN POR ALCANCE;2;0;0;Mojado;DENSA;0;0;0;Accidente sin heridos en carril derecho. Vehículo 1 se retira por sus medios. Vehículo 2 es retirado por grúa de ollero.
14/04/2021 0:00;18:05:49;20210414-0033;04AT50;SUPERFICIE;A2;AT;TRONCO;Colision entre vehiculos;COLISIÓN POR ALCANCE;1;1;0;Seco y limpio;CONGESTIONADA;1;0;0;AVISO DE CENTRO DE CONTROL PARA SEÑALIZAR ACCIDENTE. A LA LLEGADA SE ENCUENTRA UNA MOTOCICLETA CAIDA EN ARCEN DERECHO. POLICIA INFORMA QUE SE HA TRATADO DE UN ALCANCE ENTRE MOTOCICLETA Y TURISMO (EL TURISMO NO ESTA Y EL MOTORISTA TAMPOCO YA QUE HA SIDO TRASLADADO POR SAMUR AL RAMON Y CAJAL). LA GRUA DEL USUARIO RETIRA VEHICULO Y JUNTO CON V1 LIMPIAMOS VERTIDO DE COMBUSTIBLE EN ARCEN.
14/04/2021 0:00;18:34:00;20210414-0035;07NL40;SUPERFICIE;M30;NL;VIA DE SERVICIO;Colision entre vehiculos;COLISIÓN POR ALCANCE;2;0;0;Seco y limpio;DENSA;1;0;0;Accidente en carril central a nuestra llegada al punto los vehículos se encuentran en carril derecho con policía y samur, un vehículo se retira por sus medios ,el otro es  retirado por su grúa y un herido leve dado de alta en el punto
14/04/2021 0:00;18:44:32;20210414-0036;14NL09;TÚNEL;M30;NL;VIA DE SERVICIO;Otros;Otro;2;0;0;Seco y limpio;FLUIDA;0;0;0;ALCANCE DE DOS COCHES: CUANDO LLEGAMOS NO HAY DAÑOS Y SE RETIRAN POR SUS MEDIOS.
15/04/2021 0:00;14:35:31;20210415-0018;04NL90;SUPERFICIE;M30;NL;VIA DE SERVICIO;Colision entre vehiculos;Otro;0;0;0;Seco y limpio;DENSA;0;0;0;AVISA CENTRO DE CONTROL DE ACCIDENTE. ANULAN ANTES DE LLEGAR AL PUNTO
15/04/2021 0:00;14:39:00;20210415-0019;31NC90;SUPERFICIE;M30;NC;TRONCO;Colision entre vehiculos;COLISIÓN POR ALCANCE;3;0;0;Seco y limpio;CONGESTIONADA;1;0;0;ACCIDENTE ENTRE VEHÍCULOS POR ALCANCE. VEHÍCULOS 1 Y 2 SE RETIRAN POR SUS MEDIOS Y EI VEHÍCULO 3 ES RETIRADO POR LA GRÚA DEL USUARIO. 1 HERIDO LEVE ES TRASLADADO AL HOSPITAL DE LA PAZ
15/04/2021 0:00;15:12:55;20210415-0020;14XL99;TÚNEL;M30;XL;VIA DE SERVICIO;Colision entre vehiculos;COLISIÓN POR ALCANCE;2;0;0;Seco y limpio;DENSA;0;0;0;COLISION POR ALCANCE ENTRE DOS VEHICULOS, SIN DAÑOS PERSONALES NI MATERIALES. AMBOS SE RETIRAN POR SUS MEDIOS
15/04/2021 0:00;16:55:00;20210415-0024;05XL50;SUPERFICIE;M30;XL;VIA DE SERVICIO;Colision entre vehiculos;COLISIÓN LATERAL;2;0;1;Seco y limpio;DENSA;0;0;0;alcance lateral entre camión y turismo sin heridos los usuarios se toman datos y se retiran por sus medios
15/04/2021 0:00;19:45:00;20210415-0029;99PT06;SUPERFICIE;M30;99PT;TABLERO;Colision entre vehiculos;COLISIÓN POR ALCANCE;2;0;0;Seco y limpio;FLUIDA;1;0;0;alcance entre vehículos en carril izquierdo ,los vehículos son retirados por las grúas de los usuarios ,sin daños al patrimonio y un herido del vehículo dos es trasladado leve al hospital de la princesa
16/04/2021 0:00;8:56:02;20210416-0014;13XL00;SUPERFICIE;M30;XL;VIA DE SERVICIO;Colision entre vehiculos;COLISIÓN POR ALCANCE;2;0;0;Seco y limpio;DENSA;0;0;0;Señalizar colisión entre dos vehículos en carril derecho. El primer vehículo sale por sus medios y el segundo vehículo es retirado por la grúa del seguro
16/04/2021 0:00;9:29:21;20210416-0016;12NL80;SUPERFICIE;M30;NL;VIA DE SERVICIO;Colision entre vehiculos;COLISIÓN POR ALCANCE;3;0;0;Seco y limpio;DENSA;1;0;0;Señalizar accidente por alcance en carril derecho. El vehículo número 1 se retira por sus propios medios  y los vehículos 2 y 3 se retiran en grúa seguro, policía municipal activa a grúas López Ollero pero no llega a cargar. El herido del vehículo número 3 es trasladado al hospital de la Concepción como leve , y se limpia aceite en carril derecho, sin daños a patrimonio
16/04/2021 0:00;11:49:42;20210416-0019;10XL00;SUPERFICIE;M30;XL;VIA DE SERVICIO;Otros;Otro;0;0;0;Seco y limpio;CONGESTIONADA;1;0;0;ACCIDENTE GRAVE CON POSIBLE PRECIPITADO. LLEGO AL PUNTO JUNTO CON V4, POLICIA NACIONAL Y MUNICIPAL SE ENCUENTRAN EN EL PUNTO, CORTAMOS 2 CARRILES DERECHOS, LLEGA AL PUNTO CAPATAZ DE VIGILANCIA, SAMUR Y BOMBEROS. SAMUR TRASLADA AL HERIDO AL HOSPITAL 12 DE OCTUBRE.SE RETIRA BOMBEROS, POLICIA NACIONAL Y MUNICIPAL. RECOGEMOS CORTE Y FINALIZAMOS
16/04/2021 0:00;11:56:40;20210416-0020;10XL10;SUPERFICIE;M30;XL;VIA DE SERVICIO;Otros;Otro;0;0;0;Seco y limpio;FLUIDA;0;0;0;ANULADO, AL LLEGAR AL PUNTO NO HAY ACCIDENTE
16/04/2021 0:00;12:09:10;20210416-0021;16NC08;TÚNEL;M30;NC;TRONCO;Colision entre vehiculos;COLISIÓN POR ALCANCE;2;0;0;Seco y limpio;DENSA;0;0;0;DOS VEHICULOS ACCIDENTE LEVE NO LLEGAMOS A ACTUAR SE RETIRAN ANTES DE LLEGAR
16/04/2021 0:00;13:46:28;20210416-0024;10NL60;SUPERFICIE;M30;NL;VIA DE SERVICIO;Otros;Otro;2;0;0;Seco y limpio;DENSA;0;0;0;ACCIDENTE LEVE SIN HERIDOS EN CARRIL DERECHO ENTRE 2 VEHICULOS. POLICIA EN EL PUNTO. CORTAMOS CARRIL DERECHO. EL 1 VEHICULO SE MARCHA POR SUS MEDIOS. EL 2 VEHICULO ES RETIRADO POR LA GRUA DEL USUARIO. RECOGEMOS CORTE Y FINALIZAMOS
16/04/2021 0:00;14:43:00;20210416-0026;02NL00;SUPERFICIE;M30;NL;VIA DE SERVICIO;Otros;Otro;0;0;0;Seco y limpio;CONGESTIONADA;0;0;0;Accidente en carril derecho, a mí llegada al punto no hay nadie
16/04/2021 0:00;14:53:29;20210416-0027;00NC50;SUPERFICIE;M30;NC;TRONCO;Colision entre vehiculos;COLISIÓN POR ALCANCE;2;0;0;Seco y limpio;CONGESTIONADA;0;0;0;accidente en carril derecho sin heridos los vehículos son retirados por sus grúas
16/04/2021 0:00;15:27:00;20210416-0032;10NL60;SUPERFICIE;M30;NL;VIA DE SERVICIO;Colision entre vehiculos;COLISIÓN POR ALCANCE;2;0;0;Seco y limpio;CONGESTIONADA;1;0;0;AVISO DE CENTRO DE CONTROL PARA SEÑALIZAR ACCIDENTE POR ALCANCE EN CARRIL DERECHO. SAMUR ATIENDE A UN HERIDO Y ES DADO DE ALTA EN EL PUNTO. VEHICULO 1 SE RETIRA POR SUS PROPIOS MEDIOS Y VEHICULO 2 SE RETIRA CON LA GRUA DEL SEGURO. SIN DAÑOS A PATRIMONIO.
16/04/2021 0:00;15:35:05;20210416-0033;01MT20;SUPERFICIE;M11;MT;TRONCO;Colision entre vehiculos;COLISIÓN POR ALCANCE;2;0;0;Seco y limpio;FLUIDA;0;0;0;Accidente sin heridos en arcén derecho. Vehículo 2 se retira por sus medios. Vehículo 1 es retirado por su grúa.
16/04/2021 0:00;17:36:09;20210416-0040;05XL10;SUPERFICIE;M30;XL;VIA DE SERVICIO;Otros;Otro;2;0;0;Seco y limpio;DENSA;0;0;0;accidente en carril derecho sin heridos un vehículo se retira por sus medios y el otro retirado por su grúa
16/04/2021 0:00;19:02:27;20210416-0043;10NL90;SUPERFICIE;M30;NL;VIA DE SERVICIO;Colision entre vehiculos;COLISIÓN POR ALCANCE;3;0;0;Seco y limpio;CONGESTIONADA;2;0;0;AVISO DE CENTRO DE CONTROL PARA SEÑALIZAR ACCIDENTE EN CARRIL CENTRAL, SON PASADOS POR MOTO 3 AL ARCEN DERECHO. SAMUR ATIENDE A DOS HERIDOS Y SON DADOS DE ALTA EN EL PUNTO. VEHICULO 1 SE RETIRA DEL PUNTO POR SUS PROPIOS MEDIOS Y VEHICULOS 2 Y 3 POR SUS RESPECTIVAS GRUAS. SIN DAÑOS PATRIMONIO.
17/04/2021 0:00;17:54:29;20210417-0019;08NL10;SUPERFICIE;M30;NL;VIA DE SERVICIO;Salida de via;Otro;1;1;0;Seco y limpio;FLUIDA;1;0;0;SEÑALIZO CAIDA DE MOTORISTA, NO HAY DAÑOS AL PATRIMONIO Y HAY UN HERIDO TRASLADADO AL HOSPITAL 12 DE OCTUBRE SIN PRONÓSTICO.
18/04/2021 0:00;12:13:48;20210418-0005;15XC06;TÚNEL;M30;XC;TRONCO;Colision entre vehiculos;COLISIÓN POR ALCANCE;3;0;0;Seco y limpio;FLUIDA;1;0;0;SE REALIZA CONTROL DE RIESGOS. UN USUARIO NOS SOLICITA SAMUR AL RATO DE LLEGAR NOSOTROS ALLI. LA USUARIA ATENDIDA ES DADA DE ALTA EN EL PUNTO. SOLICITAMOS DOS PLATAFORMAS. UNO DE LOS VEHICULOS SALE POR SUS MEDIOS. SACAMOS DOS VEHICULOS A LA CALLE ANTONIO LOPEZ. DOS AGENTES EVACUAMOS A CUATRO USUARIOS POR LA S. E 10 TRAMO 3 (14XC95) Y NOS REUNIMOS CON AMBAS PLATAFORMAS EN ANTONIO LOPEZ.
18/04/2021 0:00;14:25:53;20210418-0010;07XC20;SUPERFICIE;M30;XC;TRONCO;Otros;Otro;2;0;0;Seco y limpio;FLUIDA;0;0;0;accidente leve sin daños ni heridos en carril derecho los pasamos al arcén toman datos del seguro y continúan la marcha por sus propios medios
18/04/2021 0:00;21:40:53;20210418-0017;12RL00;SUPERFICIE;A4;12RL;RAMAL;Colision entre vehiculos;COLISIÓN POR ALCANCE;2;0;0;Seco y limpio;FLUIDA;0;0;0;AVISA C. CONTROL DE COLISION DE VEHICULOS. CUANDO LLEGO SOLO HAY UN VEHICULO, EL OTRO SE HA MARCHADO POR SUS MEDIOS, NO HAY DAÑOS NI HERIDOS, CORTO CARRIL IZDO A ESPERA GRUA SEGURO.
19/04/2021 0:00;8:40:27;20210419-0006;01NC50;SUPERFICIE;M30;NC;TRONCO;Colision entre vehiculos;COLISIÓN POR ALCANCE;2;0;0;Seco y limpio;DENSA;0;0;0;ACCIDENTE LEVE, TOMAN LOS DATOS Y SE MARCHAN  POR SUS MEDIOS
19/04/2021 0:00;9:02:23;20210419-0008;08XC00;SUPERFICIE;M30;XC;TRONCO;Colision entre vehiculos;Otro;0;0;0;Seco y limpio;DENSA;0;0;0;A M ILLEGADA NO HAY NADA
19/04/2021 0:00;11:25:18;20210419-0013;04AT30;SUPERFICIE;A2;AT;TRONCO;Colision entre vehiculos;COLISIÓN POR ALCANCE;3;0;0;Seco y limpio;CONGESTIONADA;1;0;0;ACCIDENTE EN CARRIL DERECHO. AL LLEGAR AL PUNTO 2 DE LOS 3 VEHICULOS SE RETIRAN POR SUS MEDIOS Y EL VEHICULO QUE QUEDA ES RETIRADO POR LA GRUA DE MOVILIDAD. ACCIDENTE CON DAÑOS AL PATRIMONIO Y 1 HERIDO DADO DE ALTA EN EL PUNTO. SE LIMPIA VERTIDO DE ACEITE ANTES DE FINALIZAR LA INCIDENCIA.
19/04/2021 0:00;14:28:06;20210419-0018;03NC00;SUPERFICIE;M30;NC;TRONCO;Colision entre vehiculos;Otro;0;0;0;Seco y limpio;CONGESTIONADA;0;0;0;AVISO DE C.CONTROL ACCIDENTE, SE ANULA LOS VEHICULOS SE HAN RETIRADO POR SUS MEDIOS
19/04/2021 0:00;14:34:22;20210419-0019;04AT50;SUPERFICIE;A2;AT;TRONCO;Colision entre vehiculos;COLISIÓN POR ALCANCE;0;0;0;Seco y limpio;FLUIDA;0;0;0;AVISO: ACCIDENTE. ANULADO POR RETIRADA DE LOS VEHICULOS.
19/04/2021 0:00;17:21:29;20210419-0023;00XC40;SUPERFICIE;M30;XC;TRONCO;Colision entre vehiculos;Otro;0;0;0;Seco y limpio;DENSA;0;0;0;AVISO DE C.CONTROL ACCIDENTE A MI LLEGADA NO HAY NADA
19/04/2021 0:00;17:40:41;20210419-0024;04AT50;SUPERFICIE;A2;AT;TRONCO;Colision entre vehiculos;COLISIÓN POR ALCANCE;3;0;0;Seco y limpio;DENSA;0;0;0;AVISO DE CENTRO CONTROL ACCIDENTE POR ALCANCE EN CARRIL DERECHO, EL VEHICULO 1 Y 2 SE RETIRAN POR SUS MEDIOS, EL VEHICULO 3 ES RETIRADO POR LA GRUA DEL SEGURO Y EL USUARIO SE VA EN TAXI
19/04/2021 0:00;20:47:29;20210419-0028;09RL00;SUPERFICIE;M30;09RL;RAMAL;Colision entre vehiculos;COLISIÓN LATERAL;5;0;0;Seco y limpio;FLUIDA;0;0;0;AVISO DE CENTRO CONTROL ACCIDENTE EN RAMAL, A MI LLEGADA POLICIA SE ENCUENTRA CORTANDO EL 09RL Y EL 09RH, SON 5 VEHICULOS IMPLICADOS, 3 DE ELLOS ESTABAN APARCADOS EN EL LUGAR, SAMUR VIENE AL PUNTO POR APOYO PERO NO ATIENDE A NADIE DEL ACCIDENTE, EL VEHICULO 1 Y 2 SE RETIRAN POR SUS MEDIOS, EL VEHICULO 3 ES RETIRADO POR LA GRUA DEL SEGURO Y LA USUARIA SE VA ANDANDO Y LOS VEHICULOS 4 Y 5 SON RETIRADOS POR LAS GRUAS DE LOS SEGUROS Y CADA USUARIO DE CADA VEHICULO SE VA EN LOS TAXIS DE CADA SEGURO
19/04/2021 0:00;23:38:15;20210419-0029;07NL60;SUPERFICIE;M30;NL;VIA DE SERVICIO;Colision entre vehiculos;COLISIÓN POR ALCANCE;2;1;0;Seco y limpio;FLUIDA;1;0;0;Señalizar accidente por colisión entre turismo y moto, en carriles derechos, samur interviene en el punto trasladando a usuaria de moto al Gregorio Marañón con pronóstico reservado, vehículo 1 es retirado por la grúa del seguro y la moto es retirada por la grúa de movilidad
20/04/2021 0:00;8:39:02;20210420-0007;32NC20;SUPERFICIE;M30;NC;TRONCO;Colision entre vehiculos;COLISIÓN POR ALCANCE;2;0;0;Mojado;CONGESTIONADA;0;0;0;colisión por alcance de dos vehículos, los usuarios toman datos en apartadero derecho y reanudan marcha
20/04/2021 0:00;15:23:20;20210420-0014;05AT00;SUPERFICIE;A2;AT;TRONCO;Colision entre vehiculos;COLISIÓN POR ALCANCE;2;1;0;Mojado;CONGESTIONADA;2;0;0;AVISO: ACCIDENTE EN CARRIL DERECHO.  CORTE DE CARRIL DERECHO.  A MI LLEGADA SOLO QUEDA LA MOTO EN EL PUNTO, EL TURIAMO SE HA RETIRADO POR SUA MEDIOS. ACTUA SAMUR ATENDIENDO A LOS DOS CONDUCTORES, EL DEL TURIAMO ES DADO DE ALTA Y EL DE LA MOTO ES TRASLADADO SIN PRONOSTICAR. LA MOTO ES RETIRADA POR LA GRÚA DEL USUARIO.
20/04/2021 0:00;18:25:20;20210420-0019;14RE04;TÚNEL;M30;14RE;RAMAL;Otros;Otro;0;0;0;Seco y limpio;CONGESTIONADA;0;0;0;VEHICULO QUE DESPLAZA UNA BAÑERA Y TIRA DOS HITOS , LOS VOLVEMOS A COLOCAR, EL VEHICULO A NUESTRA LLEGADA YA HABIA REANUDADO LA MARCHA POR SUS MEDIOS
20/04/2021 0:00;20:42:33;20210420-0026;09VT10;SUPERFICIE;M30;09VT;RAMAL;Colision entre vehiculos;COLISIÓN POR ALCANCE;1;0;0;Seco y limpio;FLUIDA;0;0;0;AVISO DE C.CONTROL ACCIDENTE EN CARRIL DERECHO, A MI LLEGADA SOLO QUEDA UN VEHICULO QUE SE RETIRA POR SUS MEDIOS
21/04/2021 0:00;16:37:40;20210421-0028;09OT30;SUPERFICIE;M-607;OT;TRONCO;Colision entre vehiculos;COLISIÓN POR ALCANCE;2;1;0;Seco y limpio;FLUIDA;0;0;0;ACCIDENTE POR ALCANCE DE MOTO A COCHE.SIN HERIDOS,SIN DAÑOS.LOS VEHICULOS LOS RETIRA GRÚA USUARIOS Y TAXI.
21/04/2021 0:00;16:52:59;20210421-0029;12OT50;SUPERFICIE;M-607;OT;TRONCO;Salida de via;COLISIÓN MEDIANA;1;0;0;Seco y limpio;FLUIDA;1;0;0;AVISO: ACCIDENTE. AL LLEGAR AL PUNTO  SE TRATA DE UNA SALIDA DE VIA MARGEN IZQUIERDO CON COLISION CONTRA LA DOBLE BARRERA DE LA MEDIANA. ACTUA BOMBEROS, SAMUR Y GUARDIA CIVIL. EL SAMUR DA DE ALTA AL CONDUCTOR DEL VEHICULO EN EL PUNTO. A MI LLEGADA SOLO QUEDA GUARDIA CIVIL Y EL VEHICULO CARGADO EN SU GRUA EN EL ARCEN DERECHO. INFORMO AL CENTRO DE CONTROL Y A JEFE DE TURNO DE LOS DAÑOS Y DE QUE NO PUEDO SEÑALIZARLOS Y QUE LO HARAN ESTA NOCHE. EL VEHICULO ES RETIRADO POR SU ASISTENCIA.
21/04/2021 0:00;19:02:39;20210421-0034;10NL95;SUPERFICIE;M30;NL;VIA DE SERVICIO;Colision entre vehiculos;COLISIÓN POR ALCANCE;2;0;0;Seco y limpio;DENSA;0;0;0;Accidente sin heridos en arcén derecho. Los vehículos se retiran por sus medios.
22/04/2021 0:00;8:22:03;20210422-0004;98IT10;SUPERFICIE;M30;IT;TRONCO;Colision entre vehiculos;COLISIÓN POR ALCANCE;3;0;0;Mojado;DENSA;1;0;0;ACCIDENTE EN CARRIL IZQUIERDO LO ENCUENTRA CONSERVACION SEÑALIZA HASTA MI LLEGADA ( HERIDO ES DADO DEALTA EN EL LUGAR)
22/04/2021 0:00;8:39:10;20210422-0006;30RA00;SUPERFICIE;M30;30RA;RAMAL;Colision entre vehiculos;COLISIÓN POR ALCANCE;3;0;0;Mojado;CONGESTIONADA;0;0;0;Señalizacion de accidente por alcance entre 3 vehiculos sin heridos,Policía Municipal se encuentra en el pk,retirado por 2 grua s seguro usuarios y 1 vehiculo porsus propios medios. (Daos vehiculo 1 proporcionados por Policía Municipal).
22/04/2021 0:00;8:50:44;20210422-0009;24NC00;SUPERFICIE;M30;NC;TRONCO;Otros;COLISIÓN MEDIANA;1;0;0;Mojado;FLUIDA;0;0;0;colision hastial izquierdo contra muro de hormigón y posible daño según policía no se sabe dónde se ha dado
22/04/2021 0:00;17:37:36;20210422-0037;11NL10;SUPERFICIE;M30;NL;VIA DE SERVICIO;Colision entre vehiculos;COLISIÓN POR ALCANCE;2;0;1;Seco y limpio;DENSA;0;0;0;AVISO DE CENTRO DE CONTROL DE ACCIDENTE POR ALCANCE EN CARRIL DERECHO, LOS DOS VEHICULOS SE RETIRAN POR SUS MEDIOS
22/04/2021 0:00;23:10:36;20210422-0045;11OL26;SUPERFICIE;M-607;OL;TRONCO;Colision entre vehiculos;COLISIÓN POR ALCANCE;2;0;0;Seco y limpio;FLUIDA;2;0;0;señalizar  accidente con daños al patrimonio , bomberos se personan en el punto al igual  que samur que atiende  a los 2 usuarios,  el usuario  vehículo  1 es dado de alta en el punto  y el usuario  vehículo  2 es atendida en el punto y transladada al hospital  con pronóstico leve . el equipo de conservación se queda en el punto arreglando la bionda dañada
23/04/2021 0:00;13:15:49;20210423-0018;09VU13;SUPERFICIE;M-607;VU;TRONCO;Colision entre vehiculos;COLISIÓN POR ALCANCE;2;0;0;Seco y limpio;FLUIDA;0;0;0;COLISION POR ALCANCE ENTRE 2 VEHICULOS EN CARRIL DERECHO, LLEGADA V-3. LLEGA POLICIA.  SE MARCHA V-3. LLEGA GRUA USUARIO  CARGA VEHÍCULO 1Y SE RETIRA.  LLEGA OLLERO CARGA VEHÍCULO SE RETIRA , RECOJO CORTE Y NOS MARCHAMOS POLICÍA Y V-2 DEL PUNTO
23/04/2021 0:00;14:37:33;20210423-0022;99HL05;SUPERFICIE;M30;99HL;TABLERO;Colision entre vehiculos;COLISIÓN POR ALCANCE;2;1;0;Seco y limpio;CONGESTIONADA;1;0;0;AVISO DE C.CONTROL ACCIDENTE CON MOTORISTA IMPLICADO CORTANDO 2 CARRILES IZQUIERDOS HASTA RETIRADA DE ESTOS POR SUS MEDIOS, EL HERIDO ES TRASLADADO AL RAMON Y CAJAL
23/04/2021 0:00;14:50:30;20210423-0023;16XC47;TÚNEL;M30;XC;TRONCO;Colision entre vehiculos;COLISIÓN LATERAL;2;0;0;Seco y limpio;DENSA;0;0;0;COLISION POR ALCANCE ENTRE DOS VEHICULOS SIN DAÑOS PERSONALES NI AL PATRIMONIO. AMBOS SE RETIRAN POR SUS MEDIOS
23/04/2021 0:00;15:14:13;20210423-0025;17XC06;TÚNEL;M30;XC;TRONCO;Colision entre vehiculos;COLISIÓN POR ALCANCE;4;0;0;Seco y limpio;DENSA;0;0;0;COLISION ENTRE 3 VEHICULOS EN CARRIL DERECHO CENTRAL, A NUESTRA LLEGADA SE ENCUENTRAN EN CARRIL DERECHO, EL VEHICULO NUMERO 4 NO ESTA IMPLICADO EN EL ACCIDENTE, SE PARA PARA AYUDAR. RECOGEMOS LOS RESTOS DEL ACC EN CARRIL DCHO-CENTRAL Y LO ABRIMOS AL TRAFICO QUEDANDO CORTADO EL CARRIL DCHO. CARGAMOS EL VEHICULO 1 (VOLSWAGEN) EN GRUA, EL RESTO SE RETIRAN POR SUS MEDIOS, AL USUARIO DEL VEHICULO LO SACA EL VEHICULO 2 (PEUGEOT) Y LO DEJAMOS EN ERMITA DEL SANTO.
23/04/2021 0:00;16:03:46;20210423-0027;29NC95;SUPERFICIE;M30;NC;TRONCO;Colision entre vehiculos;COLISIÓN POR ALCANCE;2;0;0;Seco y limpio;FLUIDA;0;0;0;ACCIDENTE POR ALCANCE, SIN HERIDOS,SIN DAÑOS.SE RETIRAN POR SUS MEDIOS.
24/04/2021 0:00;21:39:30;20210424-0018;04AL50;SUPERFICIE;A2;AL;TRONCO;Colision entre vehiculos;COLISIÓN POR ALCANCE;3;0;0;Mojado;FLUIDA;2;0;0;señalizar accidente por alcance, en carriles izquierdos con heridos solo los vehículos números 2 y 3 son heridos leves dados de alta en el lugar los vehículos son retirados por la grúa de movilidad el vehículo número 2 y el vehículo número 1  se retira por sus medios y  veh n 3 en sus grúa seguro ,sin daños a patrimonio y se activa grúas López Ollero que no llega a cargar ningún vehículo
25/04/2021 0:00;13:57:10;20210425-0015;03NL00;SUPERFICIE;M30;NL;VIA DE SERVICIO;Colision entre vehiculos;COLISIÓN POR ALCANCE;2;0;0;Mojado;CONGESTIONADA;1;0;0;AVISO DE CENTRO DE CONTROL PARA SEÑALIZAR ACCIDENTE ENTRE DOS TURISMOS OCUPANDO CARRILES IZQUIERDOS. SAMUR ATIENDE A UN HERIDO SIN PRONOSTICO DEL VEHICULO 1 Y ES DADO DE ALTA EN EL PUNTO. POLICIA INFORMA QUE VEHICULO 1 GOLPEA A VEHICULO 2 Y ÉSTE CAUSA DAÑOS AL PATRIMONIO. V1 COLABORA EN LIMPIEZA DE CALZADA POR VERTIDO.
25/04/2021 0:00;14:07:00;20210425-0016;02NL50;SUPERFICIE;M30;NL;VIA DE SERVICIO;Colision entre vehiculos;COLISIÓN POR ALCANCE;5;0;0;Mojado;DENSA;0;0;0;accidente entre carriles centrales entre 5 vehículos sin heridos y daños al patrimonio en barrera del margen derecho los vehículos son retirados por sus grúas
25/04/2021 0:00;14:30:00;20210425-0017;31XC57;SUPERFICIE;M30;XC;TRONCO;Colision entre vehiculos;COLISIÓN POR ALCANCE;2;0;0;Mojado;DENSA;0;0;0;ACCIDENTE ENTRE VEHÍCULOS POR ALCANCE (SIN HERIDOS)VEHÍCULO  1 SE RETIRA POR SUS MEDIOS VEHÍCULO  2 ES RETIRADO POR LA GRÚA DEL USUARIO
25/04/2021 0:00;14:32:57;20210425-0018;31XC10;SUPERFICIE;M30;XC;TRONCO;Otros;Otro;1;1;0;Mojado;DENSA;1;0;0;CAÍDA DE MOTORISTA EN CARRIL DERECHO. ATENDIDO Y TRASLADADO POR SAMUR.  MOTO RETIRADOA POR GRÚA DE MOVILIDAD.
25/04/2021 0:00;15:07:41;20210425-0019;23NC10;SUPERFICIE;M30;NC;TRONCO;Salida de via;COLISIÓN MEDIANA;1;0;0;Mojado;DENSA;1;0;0;SALIDA DE VIA, GOLPEA CONTRA MEDIANA Y QUEDA EN CARRIL CENTRAL. BOMBEROS PASA POR EL PUNTO Y ATIENDE MANCGA DE GASOIL HASTA MI LLEGADA.  LA CONDUCTORA , ES ATENDIDA Y TRASLADADA POR SAMUR.  EL VEHICULO RETIRADO POR GRÚA DE USUARIO.
25/04/2021 0:00;16:32:11;20210425-0021;08XC70;SUPERFICIE;M30;XC;TRONCO;Salida de via;COLISIÓN LATERAL;1;0;0;Mojado;CONGESTIONADA;1;0;0;SEÑALIZAR ACCIDENTE POR SALIDA DE VIA DE UN TURISMO OCUPANDO DOS CARRILES IZQUIERDOS. SAMUR ATIENDE AL OCUPANTE Y ES DADO DE ALTA EN EL PUNTO. GRUA DEL SEGURO RETIRA VEHICULO Y TAXI A OCUPANTES. EL VEHICULO CAUSA DAÑOS EN MEDIANA MARGEN DERECHO 08XC90 (NO PUEDO HACER FOTO NI SEÑALIZAR DAÑOS POR MOTIVOS METEOROLOGICOS ADVERSOS Y POR TRAFICO).
25/04/2021 0:00;19:19:54;20210425-0025;23NC10;SUPERFICIE;M30;NC;TRONCO;Salida de via;COLISIÓN LATERAL;1;0;0;Mojado;FLUIDA;0;0;0;SEÑALIZAR VEHICULO AVERIADO EN ARCEN DERECHO QUE PROVIENE DE ACCIDENTE CONTRA EL MURO DE LA MEDIANA. A LA LLEGADA ME COMENTA POLICIA QUE CHOCÓ PERO NO HAY DAÑOS AL PATRIMONIO. SU GRÚA CARGA Y FINALIZAMOS.
25/04/2021 0:00;23:39:16;20210425-0033;04RT00;SUPERFICIE;A2;04RT;RAMAL;Salida de via;COLISIÓN LATERAL;1;0;0;Mojado;FLUIDA;0;0;0;Señalizar accidente salida de vía sin daños a patrimonio ni herido el vehículo retirado por grúa seguro y taxi
26/04/2021 0:00;15:12:56;20210426-0024;10NL80;SUPERFICIE;M30;NL;VIA DE SERVICIO;Colision entre vehiculos;COLISIÓN LATERAL;2;0;0;Seco y limpio;DENSA;0;0;0;Accidente sin heridos en carril derecho. Los vehículos se retiran por sus medios.
26/04/2021 0:00;22:50:00;20210426-0036;29NC20;SUPERFICIE;M30;NC;TRONCO;Otros;Otro;1;0;0;Mojado;FLUIDA;0;0;0;Señalizacion de accidente por alcance entre 2 vehiculos sin heridos,al llegar al pk solo queda 1 vehiculo, retirado por grua seguro usuario.
26/04/2021 0:00;23:24:31;20210426-0037;12NL30;SUPERFICIE;M30;NL;VIA DE SERVICIO;Colision entre vehiculos;COLISIÓN POR ALCANCE;2;0;0;Mojado;FLUIDA;0;0;0;ACCIDENTE POR ALCANCE ENTRE DOS VEHÍCULOS PROVOCANDO UN VUELCO EN EL RAMAL. ACCIDENTE SIN HERIDOS Y CON DAÑOS AL PATRIMONIO. UNO DE LOS VEHÍCULOS SE RETIRADOS POR LA GRÚA DEL USUARIO Y EL OTRO VEHÍCULO SE RETIRA POR SUS MEDIOS. CORTE DEL RAMAL 12RA Y DEL CARRIL DERECHO CENTRAL.
27/04/2021 0:00;15:20:58;20210427-0024;02NC20;SUPERFICIE;M30;NC;TRONCO;Colision entre vehiculos;Otro;0;0;0;Seco y limpio;DENSA;0;0;0;AVISA CENTRO DE CONTROL DE ACCIDENTE A MI LLEGADA NO HAY NADA
27/04/2021 0:00;15:23:29;20210427-0025;12RH91;SUPERFICIE;M30;12RH;RAMAL;Otros;Otro;0;0;0;Mojado;FLUIDA;0;0;0;ANULADO ANTES DE LLEGAR AL PUNTO
27/04/2021 0:00;18:09:18;20210427-0031;08NL94;SUPERFICIE;M30;NL;VIA DE SERVICIO;Colision entre vehiculos;COLISIÓN POR ALCANCE;2;0;0;Mojado;FLUIDA;0;0;0;Señalizar alcance entre dos vehículos en el carril izquierdo, pasan por sus propios medios al arcén
27/04/2021 0:00;18:39:35;20210427-0032;09NL10;SUPERFICIE;M30;NL;VIA DE SERVICIO;Colision entre vehiculos;Otro;0;0;0;Seco y limpio;DENSA;0;0;0;AVISA CENTRO DE CONTROL DE ACCIDENTE. ME ANULAN ANTES DE LLEGAR
27/04/2021 0:00;22:50:42;20210427-0041;10XL70;SUPERFICIE;M30;XL;VIA DE SERVICIO;Colision entre vehiculos;COLISIÓN POR ALCANCE;2;0;0;Mojado;FLUIDA;1;0;0;COLISIÓN POR ALCANCE DE DOS VEHÍCULOS, QUEDANDO UNO DE ELLOS EN CARRIL DERECHO Y OTRO EN CARRIL IZQUIERDO. UNO DE LOS USUARIOS DEL VEHÍCULO QUE QUEDA EN EL CARRIL IZQUIERDO ES ATENDIDO POR SAMUR CON DOLOR LEVE DE CUELLO Y ATAQUE DE ANSIEDAD TRASLADADO A HOSPITAL RAMÓN Y CAJAL. EL VEHÍCULO DEL CARRIL DERECHO ES SEÑALIZADO POR CONSERVACIÓN HASTA LA LLEGADA DE V4. LOS VEHÍCULOS SE RETIRAN POR SUS PROPIOS MEDIOS
