fecha;hora;numero incidencia;localizacion;ubicacion;carretera;eje;tipo via;tipo accidente;tipo colision;vehiculos implicados;motocicletas implicadas;pesados implicados;estado del firme;circulacion;heridos leves;heridos graves;victimas mortales;descripcion
31/10/2021 0:00;1899-12-30 18:29:09;20211031-0029;04NL60;SUPERFICIE;M30;NL;VIA DE SERVICIO;Salida de via;COLISIÓN MEDIANA;1;0;0;Mojado;DENSA;0;0;0;SEÑALIZAR ACCIDENTE POR SALIDA DE VIA DE UN TURISMO EN MARGEN DERECHO, SIN HERIDOS Y CON DAÑOS AL PATRIMONIO. EL VEHICULO SE RETIRA POR SUS PROPIOS MEDIOS CON ESCOLTA DE POLICIA FUERA DE ZONA.
31/10/2021 0:00;1899-12-30 18:30:00;20211031-0030;12OT40;SUPERFICIE;M-607;OT;TRONCO;Salida de via;COLISIÓN LATERAL;1;0;0;Mojado;FLUIDA;1;0;0;VEHÍCULO SE SALE DE  VIA  OCASIONADO DAÑOS EN MARGEN IZQUIERDO VEHÍCULO RETIRADO POR LA GRÚA DEL USUARIO (CON HERIDO LEVE 2 DE ALTA EN EL PUNTO)
31/10/2021 0:00;1899-12-30 19:05:42;20211031-0031;04NL60;SUPERFICIE;M30;NL;VIA DE SERVICIO;Salida de via;COLISIÓN MEDIANA;1;0;0;Mojado;DENSA;0;0;0;AVISO DE CENTRO DE CONTROL PARA SEÑALIZAR ACCIDENTE DE UN TURISMO POR SALIDA DE VIA EN ARCEN DERECHO, SIN HERIDOS Y CON DAÑOS A PATRIMONIO. GRUA DE USUARIO RETIRA VEHICULO Y TAXI A OCUPANTES.
31/10/2021 0:00;1899-12-30 20:56:58;20211031-0035;15XC17;TÚNEL;M30;XC;TRONCO;Colision entre vehiculos;COLISIÓN POR ALCANCE;2;0;0;Mojado;FLUIDA;0;0;0;LOS USUARIOS SALEN POR SUS MEDIOS.
31/10/2021 0:00;1899-12-30 21:20:15;20211031-0037;05NC70;SUPERFICIE;M30;NC;TRONCO;Colisión obstáculo;Otro;1;0;0;Mojado;DENSA;0;0;0;VEHÍCULO AVERIADO EN ARCÉN DERECHO POR COLISIONAR CON UN OBJETO EN CALZADA,POLICIA RETIRA EL OBJETO (BANDA RODADURA DE CAMION), VEHÍCULO RETIRADO POR GRÚA DE OLLERO
31/10/2021 0:00;1899-12-30 21:56:32;20211031-0039;12OL50;SUPERFICIE;M-607;OL;TRONCO;Salida de via;COLISIÓN LATERAL;1;0;0;Mojado;FLUIDA;1;0;0;CHOCA CONTRA MUROS  Y VUELCA EN CARRIL DERECHO.  A MI LLEGADA  YA ESTA CARGADO EN GRÚA.  Y UN HERIDO ATENDIDO POR SAMUR.
01/11/2021 0:00;1899-12-30 02:16:59;20211101-0007;04RT00;SUPERFICIE;A2;04RT;RAMAL;Salida de via;COLISIÓN MEDIANA;1;0;0;Mojado;FLUIDA;0;0;0;SALIDA DE VIA CONTRA MEDIANA DEL MARGEN DERECHO,SIN HERIDOS,CON DAÑOS AL PATRIMONIO,EL VEHÍCULO ES SACADO POR POLICÍA A FUERA DE ZONA
01/11/2021 0:00;1899-12-30 06:32:19;20211101-0018;18RU09;TÚNEL;A5;18RU;RAMAL;Salida de via;COLISIÓN LATERAL;1;0;0;Seco y limpio;FLUIDA;1;0;0;SALIDA DE VIA DE VEHICULO, EL VEHICULO IMPACTA CON EL BORDILLO CON EL NEUMATICO Y DESTALONA LA RUEDA NO PUDIENDO SEGUIR LA MARCHA, CON LA LLANTA MARCA EL ASFALTO EN 5 METROS. EN EL EXTERIOR UNA OCUPANTE DE VEHICULO ES ATENDIDA POR SAMUR CON UN GOLPE EN LA RODILLA
01/11/2021 0:00;1899-12-30 14:30:51;20211101-0033;23NC70;SUPERFICIE;M30;NC;TRONCO;Otros;Otro;1;1;0;Seco y limpio;FLUIDA;1;0;0;CAIDA DE MOTORISTA ATENDIDO POR SAMUR Y DADO DE ALTA EN EL PUNTO REANUDA MARCHA EN SU VEHICULO
01/11/2021 0:00;1899-12-30 18:50:29;20211101-0041;07NL35;SUPERFICIE;M30;NL;VIA DE SERVICIO;Colision entre vehiculos;COLISIÓN POR ALCANCE;2;0;0;Seco y limpio;DENSA;0;0;0;SEÑALIZAR ACCIDENTE POR ALCANCE EN ARCÉN DERECHO. CORTE DE MEDIO CARRIL DERECHO. ACCIDENTE SIN HERIDOS Y SIN DAÑOS AL PATRIMONIO. UNO DE LOS VEHÍCULOS SE RETIRADO POR LA GRÚA DE OLLERO, EL OTRO SE RETIRA POR SUS MEDIOS.
02/11/2021 0:00;1899-12-30 08:25:38;20211102-0013;23XC30;SUPERFICIE;M30;XC;TRONCO;Colision entre vehiculos;COLISIÓN POR ALCANCE;3;0;0;Seco y limpio;DENSA;2;0;0;SEÑALIZAR COLISION POR ALCANCE ENTRE 3 VEHÍCULOS EN CARRIL DERECHO,  NO HAY DAÑOS,  HAY 2 HERIDOS (PASAJEROS VEH.2), LOS HERIDOS SON DADOS DE ALTA EN EL PUNTO POR SAMUR,  VEH.1 SE RETIRA DEL PUNTO POR SUS MEDIOS,  VEH. 2 Y 3 RETIRADOS POR LAS GRÚAS DE LOS USUARIOS
02/11/2021 0:00;1899-12-30 09:37:09;20211102-0021;05XL60;SUPERFICIE;M30;XL;VIA DE SERVICIO;Colision entre vehiculos;COLISIÓN POR ALCANCE;2;0;0;Seco y limpio;DENSA;0;0;0;AVISA C. CONTROL DE ACCIDENTE SIN DAÑOS NI HERIDOS,, CUANDO LLEGO SOLO QUEDA UN VEHICULO Y ESTA PERSONAL DE CONSERVACION, UN VEHICULO SE A RETIRADO POR SUS MEDIOS Y EL OTRO LO SACA GRUA DE OLLERO FUERA DE ZONA.
02/11/2021 0:00;1899-12-30 14:40:00;20211102-0034;10NL60;SUPERFICIE;M30;NL;VIA DE SERVICIO;Colision entre vehiculos;COLISIÓN POR ALCANCE;8;0;0;Seco y limpio;CONGESTIONADA;0;0;0;SEÑALIZACION DE ACCIDENTE POR ALCANCE ENTRE 8 VEHÍCULOS SIN HERIDOS,POLICIA MUNICIPAL SE ENCUENTRAN EN EL PK,RELEVO A M1 YM4,GRUA DE LOPEZ OLLERO CARGA 1 VEHICULO,OTROS 2 VEHICULOS POR GRUA DEL SEGURO T 3 TAXIS DEL SEGURO,LOS RESTANTES SE RETIRAN POR SUS PROPIOS MEDIOS SE LIMPIA VERTIDO DE ACEITE Y RESTOS DEL ACCIDENTE.
02/11/2021 0:00;1899-12-30 18:22:38;20211102-0048;15XL18;TÚNEL;M30;XL;VIA DE SERVICIO;Colision entre vehiculos;COLISIÓN POR ALCANCE;0;0;0;Seco y limpio;CONGESTIONADA;0;0;0;ALCANCE ENTRE VEHICULOS , SE RETIRAN POR SUS MEDIOS ANTES DE NUESTRA LLEGADA , REGRESAMOS A BASE
02/11/2021 0:00;1899-12-30 18:46:00;20211102-0050;12RV80;SUPERFICIE;M30;12RV;RAMAL;Colision entre vehiculos;COLISIÓN POR ALCANCE;2;0;0;Seco y limpio;CONGESTIONADA;0;0;0;SEÑALIZAR ACCIDENTE EN ARCÉN DERECHO. ACCIDENTE SIN HERIDOS Y SIN DAÑOS AL PATRIMONIO. LOS VEHÍCULOS SE RETIRAN POR SUS MEDIOS.
02/11/2021 0:00;1899-12-30 19:45:15;20211102-0052;04NL10;SUPERFICIE;M30;NL;VIA DE SERVICIO;Colision entre vehiculos;COLISIÓN POR ALCANCE;2;0;0;Seco y limpio;DENSA;0;0;0;Accidente sin heridos en carril izquierdo. A mi llegada los usuarios están discutiendo, se espera a la llegada de Policía. A las 19:55 llega Policía y se retiran los vehículos al 04NL50 arcén derecho. Los vehículos se retiran por sus medios.
02/11/2021 0:00;1899-12-30 20:24:23;20211102-0054;10XL00;SUPERFICIE;M30;XL;VIA DE SERVICIO;Colision entre vehiculos;COLISIÓN POR ALCANCE;2;0;0;Seco y limpio;CONGESTIONADA;2;0;0;SEÑALIZACION DE ACCIDENTE POR ALCANCE ENTRE 2 VEHICULOS,CON 2 HERIDOS LEVES DEL VEHICULO 1,1 TRASLADADO AL HOSPITAL GREGORIO MARAÑON Y EL OTRO DADO DE ALTA EN EL PK,SAMUR Y POLICIA MUNICIPAL EN EL PK,RETIRADOS LOS VEHICULOSVPORVGRUAS DE LOS SEGUROS USUARIOS.
03/11/2021 0:00;1899-12-30 04:04:44;20211103-0008;04RT25;SUPERFICIE;A2;04RT;RAMAL;Salida de via;Otro;1;0;0;Mojado;FLUIDA;0;0;0;AVISO DE CENTRO CONTROL SALIDA DE VÍA EN RAMAL, CON DAÑOS AL PATRIMONIO EN MARGEN DERECHO, CORTE TOTAL DEL RAMAL 04 RT 00, ES RETIRADO POR LA GRÚA DEL SEGURO Y EL USUARIO SE VA EN EL TAXI SEGURO
03/11/2021 0:00;1899-12-30 07:14:01;20211103-0011;08XL48;SUPERFICIE;M30;XL;VIA DE SERVICIO;Salida de via;Otro;1;1;0;Seco y limpio;CONGESTIONADA;1;0;0;ACCIDENTE GRAVE CON HERIDOS. A MI LLEGADA SE ENCUENTRA POLICIA MUNICIPAL Y SAMUR EN EL PUNTO, ES UN ACCIDENTE DE UNA MOTO CON SOLO UN OCUPANTE QUE ES HERIDO LEVE Y ES TRASLADADO AL HOSPITAL NUESTRA SEÑORA DE AMERICA. LLEGA GRUA OLLEROS QUE NO CARGA EL VEHICULO POR LA LLEGADA DE LA GRUA DE MOVILIDAD QUE SI QUE CARGA EL VEHICULO. NOS MARCHAMOS TODOS DEL PUNTO.
03/11/2021 0:00;1899-12-30 07:57:35;20211103-0012;14NL62;TÚNEL;M30;NL;VIA DE SERVICIO;Otros;Otro;0;0;0;Seco y limpio;DENSA;0;0;0; ANULADA DE CAMINO A LA INCIDENCIA
03/11/2021 0:00;1899-12-30 08:42:53;20211103-0016;32RF04;SUPERFICIE;A1;32RF;RAMAL;Colision entre vehiculos;COLISIÓN POR ALCANCE;2;0;0;Seco y limpio;CONGESTIONADA;0;0;0;COLISIÓN ENTRE DOS VEHÍCULOS POR ALCANCE, SE DAN LOS DATOS Y SE RETIRAN POR SUS MEDIOS
03/11/2021 0:00;1899-12-30 14:44:13;20211103-0030;03FT62;TÚNEL;A5;FT;TRONCO;Otros;Otro;2;0;0;Seco y limpio;DENSA;0;0;0;ACCIDENTRE ENTRE DOS VEHICULOS LEVE, UNO SALE POR SUS MEDIOS (V1)Y OTRO LO CARGAMOS Y LO SASCMOS A LA CALLE SAN POL DEL MAR (V2)
03/11/2021 0:00;1899-12-30 17:26:03;20211103-0036;12RL14;SUPERFICIE;A4;12RL;RAMAL;Colision entre vehiculos;COLISIÓN POR ALCANCE;2;0;0;Seco y limpio;CONGESTIONADA;0;0;0;SEÑALIZAR ACCIDENTE EN ARCÉN DERECHO.  ACCIDENTE SIN HERIDOS Y SIN DAÑOS AL PATRIMONIO. LOS VEHICULOS SE RETIRAN POR SUS MEDIOS.
03/11/2021 0:00;1899-12-30 18:18:05;20211103-0038;14XL89;TÚNEL;M30;XL;VIA DE SERVICIO;Colision entre vehiculos;COLISIÓN POR ALCANCE;2;0;0;Seco y limpio;DENSA;1;0;0;COLISIOM POR AÑCAMCE ENTRE DOS VEHICULOS, SIN DAÑOS MATERIALES A UNQUE SI PERSONALES. SE SOLICITA SAMUR PARA ATENDER A USUARIO DEL PRIMER VEHICULO. PÑOLICIA ORDENA QUE LOS COCHES QUE PUEDEN CIRCULAR POR SUS MEDIOS SALGAN AL EXTERIOR DONDE QUEDA CON SAMUR PARA QUE ATIENDA AL HERIDO,
03/11/2021 0:00;1899-12-30 18:55:31;20211103-0039;24XC20;SUPERFICIE;M30;XC;TRONCO;Otros;Otro;0;0;0;Seco y limpio;CONGESTIONADA;0;0;0;AVISO DE CENTRO DE CONTROL ACCIDENTE. (SERVICIO ANULADO)
03/11/2021 0:00;1899-12-30 19:21:09;20211103-0041;10NL20;SUPERFICIE;M30;NL;VIA DE SERVICIO;Colision entre vehiculos;COLISIÓN LATERAL;2;0;0;Seco y limpio;CONGESTIONADA;0;0;0;SEÑALIZACION DE ACCIDENTE POR ALCANCE ENTRE 2 VEHICULOS SUMMA EN EL PK POLICIA MUNICIPAL SE PRESENTA EN EL PK Y ANULA AL SAMUR,GRUA DE LOPEZ OLLERO EN EL PK Y NO CARGA ,SE RETIRA 1 VEHICULO POR SUS MEDIOS Y EL OTRO POR GRUA SEGURO USUARIO.(SIN HERIDOS)
03/11/2021 0:00;1899-12-30 19:58:09;20211103-0046;24RH10;SUPERFICIE;M30;24RH;RAMAL;Colision entre vehiculos;COLISIÓN POR ALCANCE;2;0;0;Seco y limpio;DENSA;0;0;0;ACCIDENTE ENTRE DOS VEHÍCULOS EN CARRIL CENTRAL. LLEGO AL PUNTO CORTO 2 CARRILES IZQUIERDOS. GUARDIA CIVIL EN EL PUNTO. SAMUR LLEGA AL PUNTO. EL USUARIO DEL VEHICULO 1 NO QUIERE SER ATENDIDO POR SAMUR Y SAMUR SE RETIRA DEL PUNTO SIN ATENDER A NADIE. LOS VEHICULOS SON RETIRADOS POR LAS GRÚAS DE LOS USUARIOS LIMPIO RESTOS DEL ACCIDENTE Y FINALIZAMOS EN EL PUNTO.
03/11/2021 0:00;1899-12-30 20:07:46;20211103-0047;08NC40;SUPERFICIE;M30;NC;TRONCO;Otros;Otro;0;0;0;Seco y limpio;CONGESTIONADA;0;0;0;AVISO DEL CENTRO DE CONTROL DE ACCIDENTE EN DICHO PK AL LLEGAR AL PK NO HAY NADA.
04/11/2021 0:00;1899-12-30 09:47:09;20211104-0010;19NC50;SUPERFICIE;M30;NC;TRONCO;Colision entre vehiculos;COLISIÓN POR ALCANCE;2;0;0;Seco y limpio;FLUIDA;0;0;0;COLISIÓN ENTRE DOS VEHÍCULOS CARRIL IZQUIERDO, LO SACÓ FUERA DE ZONA, PARA DARSE LOS DATOS, NO NECESITA NINGUNO GRÚA
04/11/2021 0:00;1899-12-30 13:04:41;20211104-0017;10RC00;SUPERFICIE;M30;10RC;RAMAL;Otros;Otro;0;0;0;Seco y limpio;FLUIDA;0;0;0;ACCIDENTE LEVE. A MI LLEGADA NO HAY NADA NI NADIE EN EL PUNTO. ME RETIRO DEL PUNTO.
04/11/2021 0:00;1899-12-30 18:00:23;20211104-0028;15XL18;TÚNEL;M30;XL;VIA DE SERVICIO;Colision entre vehiculos;COLISIÓN POR ALCANCE;2;1;0;Seco y limpio;CONGESTIONADA;1;0;0;VEHICULO QUE GOLPEA A MOTO POR DETRÁS. GENERANDO DAÑOS A PATRIMONIO ( 3MTS DE ASFALTO ). EL MOTORISTA RESULTA HERIDO Y ATENDIDO Y TRASLADADO POR SAMUR AL HOSPITAL GREGORIO MARAÑON. SACAMOS LA MOTO A PASEO SANTA Mª DELA CABEZA CON C-22 EL VEHICULO SE RETIRA POR SUS MEDIOS
04/11/2021 0:00;1899-12-30 18:34:43;20211104-0030;03FT85;TÚNEL;A5;FT;TRONCO;Otros;Otro;2;0;0;Seco y limpio;DENSA;0;0;0;ACCCIDENTE POR ALCANCE ENTRE DOS VEHICULOS SIN HERIDOS, EL VEHICULO A SALE POR SUS MEDIOS Y EL B LO SACAMOS CON C-21 A LA PLAZA DE SAN POKL DFEL MAR
04/11/2021 0:00;1899-12-30 18:58:24;20211104-0033;15XL18;TÚNEL;M30;XL;VIA DE SERVICIO;Otros;Otro;1;0;0;Seco y limpio;FLUIDA;0;0;0;NO SAMUR. UN USUARIO SALE POR SUS MEDIOS ANTES DE QUE LLEGUEMOS NOSOTROS. AL SEGUNDO LE SACAMOS A LA V.S DE STA Mª DE LA CABEZA. NO HAY DAÑOS.
04/11/2021 0:00;1899-12-30 19:00:35;20211104-0034;08NL40;SUPERFICIE;M30;NL;VIA DE SERVICIO;Otros;Otro;0;0;0;Seco y limpio;CONGESTIONADA;0;0;0;AVISO DE CENTRO DE CONTROL DE UN ACCIDENTE EN CALZADA.  ANTES DE LLEGAR AL PUNTO VUELVEN A  INFORMAR DE QUE LOS VEHÍCULOS SE HAN RETIRADO Y QUE LA INCIDENCIA QUEDA COMO SERVICIO ANULADO.
04/11/2021 0:00;1899-12-30 19:12:25;20211104-0035;09OT60;SUPERFICIE;M-607;OT;TRONCO;Colision entre vehiculos;COLISIÓN POR ALCANCE;2;0;0;Seco y limpio;FLUIDA;0;0;0;Accidente sin heridos en carril derecho. A mi llegada solo hay 1 vehículo. Vehículo retirado por su grúa.
04/11/2021 0:00;1899-12-30 19:32:12;20211104-0037;08NL50;SUPERFICIE;M30;NL;VIA DE SERVICIO;Otros;Otro;0;0;0;Seco y limpio;CONGESTIONADA;0;0;0;AVISO DEL CENTRO DE CONTROL ACCIDENTE. INCIDENCIA ANULADA POR EL CENTRO CONTROL M30.
04/11/2021 0:00;1899-12-30 19:50:09;20211104-0040;02XL80;SUPERFICIE;M30;XL;VIA DE SERVICIO;Colision entre vehiculos;COLISIÓN POR ALCANCE;2;1;0;Seco y limpio;CONGESTIONADA;0;0;0;ACCIDENTE POR ALCANCE EN CARRIL IZQUIERDO. POLICIA TRASLADA EL ACCIDENTE AL CARRIL DERECHO. SIN HERIDOS Y SIN DAÑOS AL PATRIMONIO. LOS VEHÍCULOS SE RETIRAN POR SUS MEDIOS.
04/11/2021 0:00;1899-12-30 20:36:00;20211104-0042;03NL50;SUPERFICIE;M30;NL;VIA DE SERVICIO;Colision entre vehiculos;COLISIÓN POR ALCANCE;2;0;0;Seco y limpio;CONGESTIONADA;0;0;0;SEÑALIZACION DE ACCIDENTE POR ALCANCE ENTRE 2 VEHICULOS, SIN HERIDOS, POLICIA MUNICIPAL SE PRESENTA EN EL PK, LOS USUARIOS HACEN EL PARTE AMISTOSO Y SE RETIRAN POR SUS PROPIOS MEDIOS.
05/11/2021 0:00;1899-12-30 07:41:50;20211105-0006;16NC55;TÚNEL;M30;NC;TRONCO;Colision entre vehiculos;COLISIÓN LATERAL;2;1;0;Seco y limpio;CONGESTIONADA;0;0;0;COLISION ENTRE MOTO Y COCHE, SIN HERIDOS, SACAMOS LA MOTO AL EXTERIOR PASEO VIRGEN DEL PUERTO, EL VEHICULO SALE POR SUS MEDIOS
05/11/2021 0:00;1899-12-30 09:30:54;20211105-0012;06XL20;SUPERFICIE;M30;XL;VIA DE SERVICIO;Colision entre vehiculos;COLISIÓN POR ALCANCE;2;0;0;Seco y limpio;DENSA;3;0;0;AVISA CENTRO DE CONTROL DE ACCIDENTE EN CARRIL IZQUIERDO, CUANDO LLEGO HAN PASADO LOS VEHICULOS A CARRIL DERECHO, NO HAY DAÑOS Y HAY TRES HERIDOS (DADOS DE ALTA EN EL LUGAR), UN VEHICULO SE RETIRA POR SUS MEDIOS Y EL OTRO ES RETIRADO POR GRUA DE OLLERO.
05/11/2021 0:00;1899-12-30 10:31:41;20211105-0014;15NC47;TÚNEL;M30;NC;TRONCO;Colision entre vehiculos;COLISIÓN POR ALCANCE;2;0;0;Seco y limpio;FLUIDA;0;0;0;ACCIDENTE POR ALCANCE ENTRE DOS VEHICULOS, A NUESTRA LLEGADA SE ESTÁN DANDO LOS DATOS, LES ESCOLTAMOS AL EXTERIOR MIENTRAS SALEN POR SUS MEDIOS.
05/11/2021 0:00;1899-12-30 14:15:00;20211105-0022;09XL40;SUPERFICIE;M30;XL;VIA DE SERVICIO;Colision entre vehiculos;COLISIÓN POR ALCANCE;2;0;0;Seco y limpio;CONGESTIONADA;0;0;0;SEÑALIZACION DE ACCIDENTE POR ALCANCE ENTRE 2 VEHICULOS SIN HERIDOS, LOS USUARIOS SE DAN LOS DATOS Y SE RETIRAN POR SUS PROPIOS MEDIOS.
05/11/2021 0:00;1899-12-30 14:36:00;20211105-0021;10NL90;SUPERFICIE;M30;NL;VIA DE SERVICIO;Colision entre vehiculos;COLISIÓN POR ALCANCE;2;0;1;Seco y limpio;CONGESTIONADA;0;0;0;SEÑALIZAR ACCIDENTE EN ARCÉN DERECHO. POLICIA TRASLADA EL ACCIDENTE A LA ISLETA  DEL 11NL20. SIN HERIDOS Y SIN DAÑOS AL PATRIMONIO. LOS VEHÍCULOS SE RETIRAN POR SUS MEDIOS.
05/11/2021 0:00;1899-12-30 15:10:22;20211105-0023;31NC80;SUPERFICIE;M30;NC;TRONCO;Colision entre vehiculos;COLISIÓN POR ALCANCE;2;0;0;Seco y limpio;CONGESTIONADA;1;0;0;SEÑALIZACION DE ACCIDENTE POR ALCANCE ENTRE 2 VEHICULOS CON 1 HERIDO TRASLADADO AL HOSPITAL LA PAZ SIN PRONOSTICO, POLICIA MUNICIPAL EN EL PK, PASAN LOS VEHICULOS A LA ISLETA DEL 32NC10, AL LLEGAR AL PK SOLO HAY 1 VEHICULO Y SAMUR EN EL PK, EL VEHICULO SE RETIRA POR SUS PROPIOS MEDIOS. POLICIA MUNICIPAL ME FACILITA LOS DATOS DEL VEHICULO QUE FALTA
05/11/2021 0:00;1899-12-30 15:35:36;20211105-0026;03XC69;SUPERFICIE;M30;XC;TRONCO;Colision entre vehiculos;COLISIÓN POR ALCANCE;3;0;0;Seco y limpio;CONGESTIONADA;0;0;0;ACCIDENTE POR ALCANCE EN CARRIL CENTRAL. POLICIA TRASLADA EL ACCIDENTE AL ARCÉN DERECHO.  ACCIDENTE SIN HERIDOS Y SIN DAÑOS AL PATRIMONIO.  2 DE LOS VEHÍCULOS SE RETIRAN POR SUS MEDIOS  Y 1 ES RETIRADO POR LA GRUA DEL USUARIO.
05/11/2021 0:00;1899-12-30 15:45:52;20211105-0028;02NL00;SUPERFICIE;M30;NL;VIA DE SERVICIO;Otros;Otro;1;1;0;Seco y limpio;DENSA;1;0;0;Caída motorista en arcén derecho. 1 herido leve trasladado al hospital La Princesa. Vehículo retirado por su grúa.
05/11/2021 0:00;1899-12-30 16:42:35;20211105-0032;10NL20;SUPERFICIE;M30;NL;VIA DE SERVICIO;Colision entre vehiculos;COLISIÓN POR ALCANCE;2;0;0;Seco y limpio;CONGESTIONADA;0;0;0;SEÑALIZACION DE ACCIDENTE POR ALCANCE ENTRE 2 VEHICULOS SIN HERIDO, POLICÍA MUNICIPAL SE ENCUENTRA EN EL PK,LOS USUARIOS HACEN EL PARTE AMISTOSO Y SE RETIRAN POR SUS PROPIOS MEDIOS.
05/11/2021 0:00;1899-12-30 18:10:13;20211105-0036;01XC50;SUPERFICIE;M30;XC;TRONCO;Colision entre vehiculos;COLISIÓN POR ALCANCE;2;0;0;Seco y limpio;CONGESTIONADA;0;0;0;SEÑALIZACION DE ACCIDENTE POR ALCANCE ENTRE 2 VEHÍCULOS SIN HERIDOS POLICIA MUNICIPAL SE PRESENTA EN EL PK,SE LIMPIAN LOS RESTOS Y EL VERTIDO DE ACEITE UN VEHICULO SE RETIRA POR SUS MEDIOS Y EL OTRO POR GRUA DE LOPEZ OLLERO.
05/11/2021 0:00;1899-12-30 19:05:06;20211105-0040;10NL70;SUPERFICIE;M30;NL;VIA DE SERVICIO;Colision entre vehiculos;COLISIÓN POR ALCANCE;2;0;0;Mojado;CONGESTIONADA;0;0;0;ACCIDENTE EN CARRIL CENTRAL. SE TRASLADA EL ACCIDENTE AL CARRIL DERECHO.  SIN HERIDOS Y SIN DAÑOS AL PATRIMONIO.  1 DE LOS VEHÍCULOS SE RETIRA POR SUS MEDIOS Y EL OTRO VEHÍCULO ES RETIRADO POR LA GRUA DEL USUARIO.
05/11/2021 0:00;1899-12-30 19:28:03;20211105-0042;28NC70;SUPERFICIE;M30;NC;TRONCO;Colision entre vehiculos;COLISIÓN POR ALCANCE;2;0;0;Mojado;CONGESTIONADA;2;0;0;Accidente con heridos en carril izquierdo. Vehículo 2 colisiona contra vehículo 1 en 28NC70, desplazando el vehículo 1 al 28XC70 carril izquierdo. Al usuario del vehículo 2 se le hace la prueba de alcoholemia dando este negativo. 2 heridos leves  dados de alta en el lugar. Los vehículos son retirados por sus grúas. Vehículo de Emesa F-83 señaliza en 28XC70 enzona de radar de semáforo. Se cortan 2 carriles izquierdos en 28NC70 y 1 carril izquierdo en 28XC70. Vehículo 2 causante de los daños del 28XC70 carril central izquierdo. Vehículo 1 causante de los daños en acera y carril izquierdo del 28XC70 por la colisión del vehículo 2.
05/11/2021 0:00;1899-12-30 20:50:56;20211105-0048;07NC70;SUPERFICIE;M30;NC;TRONCO;Colision entre vehiculos;COLISIÓN LATERAL;2;0;1;Mojado;CONGESTIONADA;0;0;0;SEÑALIZACION DE ACCIDENTE POR ALCANCE ENTRE UN CAMION TRAILER Y UN VEHICULO SIN HERIDOS,POLICIA MUNICIPAL SE ENCUENTRA EN EL PK,RETIRADO EL VEHICULO POR GRUA SEGURO USUARIA Y EL TRAILER SE RETIRA POR SUS PROPIOS MEDIOS.
06/11/2021 0:00;1899-12-30 07:13:34;20211106-0006;09RL00;SUPERFICIE;M30;09RL;RAMAL;Colision entre vehiculos;COLISIÓN LATERAL;4;0;0;Seco y limpio;FLUIDA;2;0;0;señalizar accidente entre dos vehículos en salida de Peña prieta los vehículos y los restos quedan fuera de zona se ocupa SELUR de la limpieza samur interviene en el punto y traslada a usuario del vehículo 1 al infanta Leonor con pronóstico reservado guía usuario de vehículo 2 al Gregorio Marañón vehículo uno es retirado por grúa de movilidad vehículo dos es retirado por la grúa del usuario
06/11/2021 0:00;1899-12-30 11:04:08;20211106-0010;28XC60;SUPERFICIE;M30;XC;TRONCO;Colision entre vehiculos;COLISIÓN POR ALCANCE;2;0;0;Seco y limpio;FLUIDA;0;0;0;ACCIDENTE LEVE SIN HERIDOS EN CARRIL IZQUIERDO ENTRE 2 VEHÍCULOS. CORTO CARRIL IZQUIERDO. POLICIA LLEGA AL PUNTO Y SACAMOS LOS VEHÍCULOS FUERA DE LIMITES M30. RECOJO CORTE Y FINALIZAMOS EN EL PUNTO
06/11/2021 0:00;1899-12-30 12:00:33;20211106-0012;29NC50;SUPERFICIE;M30;NC;TRONCO;Colision entre vehiculos;COLISIÓN POR ALCANCE;2;0;1;Seco y limpio;FLUIDA;0;0;0;ACCIDENTE LEVE SIN HERIDOS EN CARRIL DERECHO ENTRE 1 VEHÍCULO Y 1 CAMION. CORTO CARRIL DERECHO. LOS VEHÍCULOS SE TOMAN DATOS Y ABANDONAN EL PUNTO POR SUS MEDIOS. RECOJO CORTE Y FINALIZAMOS EN EL PUNTO
06/11/2021 0:00;1899-12-30 12:36:00;20211106-0013;06NC30;SUPERFICIE;M30;NC;TRONCO;Colision entre vehiculos;COLISIÓN POR ALCANCE;2;0;0;Seco y limpio;DENSA;3;0;0;Señalizar accidente por alcance en carril derecho ,lo retiro al ramal 07RA30, el vehículo número 1 ,tiene un herido dado de alta en el lugar, el vehículo número 2,tiene 2 heridos leves dados de alta en el lugar por Samur, los vehículos se retiran por sus propios medios
06/11/2021 0:00;1899-12-30 13:06:00;20211106-0015;02XL30;SUPERFICIE;M30;XL;VIA DE SERVICIO;Colision entre vehiculos;COLISIÓN POR ALCANCE;2;0;0;Seco y limpio;DENSA;0;0;0;señalizar colisión entre dos vehículos en carril izquierdo sin heridos ni daños los vehículos andan y los saco fuera de zona hacia Serrano galvache
06/11/2021 0:00;1899-12-30 14:35:00;20211106-0019;00XC20;SUPERFICIE;M30;XC;TRONCO;Colision entre vehiculos;COLISIÓN POR ALCANCE;2;0;0;Seco y limpio;DENSA;0;0;0;Señalizar accidente por alcance en carril derecho sin daños a patrimonio ni heridos los vehículos se retiran por sus propios medios
06/11/2021 0:00;1899-12-30 18:39:47;20211106-0026;05UT10;SUPERFICIE;A4;UT;TRONCO;Colision entre vehiculos;COLISIÓN POR ALCANCE;3;0;0;Seco y limpio;DENSA;1;0;0;SEÑALIZO ACCIDENTE POR ALCANCE EN CARRIL DERECHO, ES ATENDIDO EL CONDUCTOR DEL VEHÍCULO 1 POR SAMUR EN EL PUNTO Y DADO DE ALTA EN EL LUGAR, EL VEHÍCULO 1 SE RETIRA POR SUS MEDIOS, EL VEHÍCULO 2 ES RETIRADO POR LA GRÚA DEL SEGURO, LOS OCUPANTES LOS SACA POLICÍA MUNICIPAL FUERA DE ZONA, EL VEHÍCULO 3 ES RETIRADO POR LA GRÚA DEL SEGURO Y LOS OCUPANTES SE VAN CON UN FAMILIAR QUE VIENE AL PUNTO
07/11/2021 0:00;1899-12-30 11:40:00;20211107-0014;08VA06;SUPERFICIE;A3;08VA;RAMAL;Colision entre vehiculos;COLISIÓN POR ALCANCE;4;0;0;Seco y limpio;FLUIDA;0;0;0;señalizar accidente por  alcance . vehículo número 3 estaciona en parada de autobús para recoger dos peatones y los demás vehículos colisionan produciéndose el dicho accidente sin heridos ni daños a patrimonio los vehículos número 1, 2 y 3 se retiran por sus propios medios y el vehículo número cuatro se retira en su grúa seguro y taxi
07/11/2021 0:00;1899-12-30 14:00:00;20211107-0017;07RT40;SUPERFICIE;M30;07RT;RAMAL;Salida de via;COLISIÓN LATERAL;1;0;0;Seco y limpio;FLUIDA;0;0;0;Señalizar accidente salida de vía con daños a patrimonio y sin heridos el vehículo es retirado por grúa del seguro
08/11/2021 0:00;1899-12-30 14:05:22;20211108-0023;04AT79;SUPERFICIE;A2;AT;TRONCO;Colision entre vehiculos;COLISIÓN POR ALCANCE;3;0;0;Seco y limpio;DENSA;2;0;0;ALCANCE ENTRE 3 VEHÍCULOS EN CARRILES DERECHOS SIN DAÑOS AL PATRIMONIO VEHÍCULOS 1 Y 2 SE RETIRAN POR SUS MEDIOS EL VEHÍCULO TRES ES RETIRADO POR SU GRÚA DOS HERIDOS LEVES TRASLADADOS AL HOSPITAL LA PRINCESA DEL VEHÍCULO 3
08/11/2021 0:00;1899-12-30 18:34:23;20211108-0032;11NL00;SUPERFICIE;M30;NL;VIA DE SERVICIO;Colision entre vehiculos;COLISIÓN POR ALCANCE;2;0;0;Seco y limpio;CONGESTIONADA;0;0;0;AVISO DE CENTRO PARA SEÑALIZAR ACCIDENTE POR ALCANCE ENTRE FURGONETA Y TURISMO EN APARTADERO CON 10RC00, SIN HERIDOS NI DAÑOS A PATRIMONIO. LOS VEHICULOS SE RETIRAN DEL PUNTO POR SUS PROPIOS MEDIOS.
08/11/2021 0:00;1899-12-30 18:37:26;20211108-0033;08NL90;SUPERFICIE;M30;NL;VIA DE SERVICIO;Colision entre vehiculos;COLISIÓN POR ALCANCE;2;0;0;Seco y limpio;DENSA;0;0;0;ALCANCE EN CARRIL IZQUIERDO A MÍ LLEGADA AL PUNTO LOS VEHÍCULOS SE ENCUENTRAN EN ARCÉN DERECHO JUNTO A POLICÍA TOMAN DATOS Y SE RETIRAN DEL PUNTO POR SUS MEDIOS SIN DAÑOS AL PATRIMONIO NI HERIDOS
08/11/2021 0:00;1899-12-30 19:24:19;20211108-0037;05NL70;SUPERFICIE;M30;NL;VIA DE SERVICIO;Colision entre vehiculos;COLISIÓN POR ALCANCE;2;0;0;Seco y limpio;DENSA;0;0;0;ALCANCE ENTRE VEHÍCULOS EN CARRIL DERECHO A MÍ LLEGADA AL PUNTO SE ENCUENTRAN EN ARCÉN DERECHO JUNTO A POLICÍA SE TOMAN DATOS Y SE RETIRAN POR SUS MEDIOS SIN HERIDOS Y SIN DAÑOS AL PATRIMONIO
08/11/2021 0:00;1899-12-30 21:14:12;20211108-0040;04XC20;SUPERFICIE;M30;XC;TRONCO;Colision entre vehiculos;COLISIÓN POR ALCANCE;2;0;0;Seco y limpio;DENSA;0;0;0;AVISO DE CENTRO DE CONTROL PARA SEÑALIZAR ACCIDENTE POR ALCANCE ENTRE 2 TURISMOS SIN HERIDOS NI DAÑOS A PATRIMONIO. LOS USUARIOS SE TOMAN LO DATOS Y SE RETIRAN DEL PUNTO POR SUS PROPIOS MEDIOS.
09/11/2021 0:00;1899-12-30 05:10:07;20211109-0007;04RE00;SUPERFICIE;A2;04RE;RAMAL;Salida de via;COLISIÓN FRONTAL;1;0;0;Seco y limpio;FLUIDA;0;0;0;SEÑALIZAR SALIDA DE VIA EN RAMAL. CORTE TOTAL DEL RAMAL. ACCIDENTE SIN HERIDOS Y CON DAÑOS AL PATRIMONIO. EL VEHÍCULO ES RETIRADO POR LA GRÚA DEL USUARIO. SE LIMPIA EL VERTIDO CAUSADO POR EL ACCIDENTE.
09/11/2021 0:00;1899-12-30 07:45:54;20211109-0008;15XL28;TÚNEL;M30;XL;VIA DE SERVICIO;Colision entre vehiculos;COLISIÓN LATERAL;2;1;0;Seco y limpio;FLUIDA;1;0;0;MOTO QUE GOLPEA COCHE. SAMUR ATIENDE A CONDUCTOR DE MOTO EN EL LUGAR. EL TURISMO SALE POR SUS MEDIOS , NOSOTROS SACAMOS LA MOTO CON C-22 A PASEO SANTA Mª DE LA CABEZA
09/11/2021 0:00;1899-12-30 17:26:01;20211109-0016;09LC72;SUPERFICIE;A3;LC;TRONCO;Otros;Otro;0;0;0;Seco y limpio;DENSA;1;0;0;AVISO DE CENTRO DE CONTROL PARA SEÑALIZAR POSIBLE PRECIPITACION DE PEATON A CALZADA XL. A LA LLEGADA EL PEATON SE ENCUENTRA A SALVO, SAMUR ATIENDE Y TRASLADA AL PACIENTE SIN PRONOSTICO AL HOSPITAL GREGORIO MARAÑON. POLICIA INFORMA QUE SON VARIAS LAS OCASIONES EN LA QUE LA MISMA PERSONA Y EN EL MISMO PUNTO INTENTA PRECIPITARSE AL VACIO.
10/11/2021 0:00;1899-12-30 06:33:16;20211110-0006;16NC63;TÚNEL;M30;NC;TRONCO;Otros;Otro;0;0;0;Seco y limpio;FLUIDA;0;0;0;SERVICIO ANULADO
10/11/2021 0:00;1899-12-30 06:51:28;20211110-0008;04FT49;TÚNEL;A5;FT;TRONCO;Colision entre vehiculos;COLISIÓN POR ALCANCE;3;0;0;Seco y limpio;CONGESTIONADA;1;0;0;ACCIDENTE POR ALCANCE DE 3 VEHICULOS, EN PRINCIPIO SOLO DAÑOS MATERIALES HASTA QUE SE EMPEZARON A ENCONTRAR MAL 2 USUARIOS CON MAREOS, DOLORES CERVICALES Y ANSIEDAD. SAMUR ATIENDE A LOS HERIDOS, UNO DE ELLOS ES DADO DE ALTA IN SITU Y LA OTRA USUARIA ES TRASLADADA AL HOSPITAL 12 DE OCTUBRE CON PRONOSTICO RESERVADO. EL V3 SALE POR SUS MEDIOS, EL V2 SE LE LLEVA SU GRUA Y EL V1 LO LLEVAMOS A DEPOSITO MUNICIPAL.
10/11/2021 0:00;1899-12-30 07:14:52;20211110-0010;04FT85;TÚNEL;A5;FT;TRONCO;Colision entre vehiculos;COLISIÓN POR ALCANCE;2;0;0;Seco y limpio;;0;0;0;COLISION POR ALCANCE DE DOS VEHICULOS, SIN HERIDOS, LOS VEHICULOS SALEN POR SUS MEDIOS TRS ASEGURAR PARAGOLPES
